{
  "schema": "are.calc.v1",
  "calcType": "hss-to-hss-branch",
  "id": "d5513733-b590-4fd3-b55b-aa019f1d60cc",
  "member": {
    "mark": "T-3-BR",
    "type": "brace",
    "section": "HSS12X4X3/8",
    "material": { "Fy": 46, "E": 29000 }
  },
  "demands": {
    "Pu": 20,
    "Vu": 15,
    "Mu": 600,
    "Mu_op": 0
  },
  "geometry": {},
  "connection": {
    "subType": "rect-moment",
    "connType": "T",
    "chord": {
      "section": "HSS4X4X3/8",
      "Fy": 46
    },
    "branchFy": 46,
    "theta": 90,
    "Qf": 1.00,
    "orient": "H",
    "gap": null,
    "overlap": null
  },
  "results": {
    "governing": null,
    "dcr": null,
    "status": "PENDING",
    "url": "https://calcs.andersonrohr.com/calcs/hss-to-hss-branch?id=d5513733-b590-4fd3-b55b-aa019f1d60cc",
    "computedAt": null
  },
  "meta": {
    "source": "revit",
    "createdBy": "rohrengineering@gmail.com"
  }
}
