{
  "schema": "are.calc.v1",
  "calcType": "w-to-hss-column",
  "id": "8f1c534e-2738-4a1d-b014-b651779bebc4",
  "member": {
    "mark": "B-12",
    "type": "beam",
    "section": "W16X57",
    "material": { "Fy": 50, "E": 29000 }
  },
  "demands": {
    "Mu": 60,
    "Vu": null,
    "Pu": null
  },
  "geometry": {
    "L": null,
    "Lb": null,
    "Cb": null
  },
  "connection": {
    "column": {
      "section": "HSS10X10X1/2",
      "Fy": 46
    },
    "beamFy": 50
  },
  "results": {
    "governing": "Beam flange local yielding (AISC 360-22 Eq. K1-1)",
    "dcr": null,
    "status": "PENDING",
    "url": "https://calcs.andersonrohr.com/calcs/w-to-hss-column?id=8f1c534e-2738-4a1d-b014-b651779bebc4",
    "computedAt": null
  },
  "meta": {
    "source": "revit",
    "createdBy": "rohrengineering@gmail.com"
  }
}
