{
  "schema": "are.calc.v1",
  "calcType": "base-plate",
  "id": "44067003-4420-46de-89fb-807f6d998838",
  "member": {
    "mark": "C-5",
    "type": "column",
    "section": "HSS6X6X1/4",
    "material": { "Fy": 46, "E": 29000 }
  },
  "demands": {
    "Pu": 53.22,
    "Vu": 0.45,
    "Mu": 0.18
  },
  "geometry": {},
  "connection": {
    "plate": {
      "N": 14,
      "B": 14,
      "tp": 0.75,
      "Fyp": 36
    },
    "anchors": {
      "n": 4,
      "dia": 0.75,
      "gauge": 11,
      "grade": "F1554 Gr.36"
    },
    "concrete": {
      "fc": 3,
      "hef": 8,
      "cEdge": 18
    }
  },
  "results": {
    "governing": null,
    "dcr": null,
    "status": "PENDING",
    "url": "https://calcs.andersonrohr.com/calcs/base-plate?id=44067003-4420-46de-89fb-807f6d998838",
    "computedAt": null
  },
  "meta": {
    "source": "revit",
    "createdBy": "rohrengineering@gmail.com"
  }
}
